Name,Hex Code Color,Description
welcome to the poppyverse,#ff1447,Where it all begins. Your first step into this mess.
deeper into the poppyverse,#ff00a1,"Same multiverse branch, deeper layers, fewer safety rails."
the red poppyverse,#c40000,"Where the poppies blaze bright with purpose, and the petals fall faster than they should."
the orange poppyverse,#ff772b,"Everyday life, Trader Joe’s burnout, and too-real modern mundanity holding hands."
the desert roseverse,#ffd25f,"Endless sand, questionable hygiene, and even stranger things than the desert mirages."
the ultravioletverse,#5e17eb,A universe where the badass you idolize offers you life advice that sounds suspiciously like HR warnings.
the lilyverse,#005eff,"Every other DONOR is a glitching, haunting, half-present entity. This one? Full commander bars, fully corporeal, fully capable of ending you with paperwork alone."
the spider lilyverse,#4ce4ff,"Reincarnation, irony, second chances, and the universe’s terrible sense of humor."
beyond the poppyverse,#ffc5c5,Where the fourth wall gets thin and the author starts pacing.